link,date,text,ad
Qoraxabar/57945,2023-05-03 07:40:41+00:00,varikoz venalarini davolash uchun sizga tafsiya qilamiz veins varekoz sprey varikoz tomirlari va o'rgimchak tomirlarini davolaydi oyoqlarda terining ko'rinishini yaxshilaydi terini oziqlantiradi tinchlantiradi va namlaydi oyoqqo'llarning charchoqlarini mahalliy qattiq venoz shnurni venoz tarmoqning teri osti kengayishini va telangiyektaziyani engillashtiradi yetkazib berish bepul to'lov qo'lingizga olganda qilasiz eski narx 219000 so'm aksiya narx 149000 so'm 2 ta olsangiz 1 ta qo'shib beramiz buyurtma berish httpbendakstildawsvarikoz httpbendakstildawsvarikoz,1.0
Qoraxabar/57946,2023-05-03 07:40:43+00:00,jizzaxda 3 nafar shaxs yuzlab odamlarni green card yutganligiga ishontirib 25 mlrd so'mni o'zlashtirdi fuqaro dr ag' va rnlar jinoiy til biriktirgan holda 103 nafar jabrlanuvchilarni o'zlari tayyorlagan soxta hujjatlar asosida amerika qo'shma shtatiga borishi uchun green card lotereyasidan yutuq chiqqanligiga ishontirib aldash yo'li bilan ularning jami 2 mlrd 597 mln so'm pul mablag'larini qo'lga kiritgan ulardan bir nafari qamaldi qolgan ikki nafari esa qidiruvga berilgan,0.0
Qoraxabar/57947,2023-05-03 08:19:57+00:00,1966yil 26apreldagi falokatli zilziladan so'ng poytaxtni qayta tiklash ishlari janubiyg'arbdagi chilonzorda ham shiddat bilan olib borilgan qo'shni mamlakatlardan kelgan 20 000dan oshiq ustalar qurilish ishlarida jonbozlik ko'rsatganlar,0.0
Qoraxabar/57948,2023-05-03 08:20:48+00:00,yangi tahrirdagi mehnat kodeksi kuchga kirdi yaxshilab tanishib olinglar,0.0
Qoraxabar/57949,2023-05-03 08:22:50+00:00,gemorroydan qiynalyapsizsizmi talablariga binoan samarasi bilan tanilgan va uzoq kutilgan 6 talik gemorroy shprits gel endi sotuvda gemorroy bu tugri ichakning varikoz tomirlarining kengayishi va xemoroidli tugunlarning paydo bulishi kasallik astasekin usib boradi va davolanish bulmasa tezkor jarroxlik aralashuvini talab kilishi mumkin kupginina davlatlarda uz samarasi bilan tanilgan tabiiy giyoxlardan tayorlangan maxsus chayon ekstraktli gemarroy shpritsli gel samarasi deyarli darxol bilinadi maxsus balzam 6 dona shpritsdan iborat bulib kun ora ishlatiladi buyurtma berish httpuntitletildaws6 httpuntitletildaws6,1.0
Qoraxabar/57950,2023-05-03 08:22:52+00:00,milliy gvardiyaga ham jarimaga tortish vakolati berilmoqda senat ma'qullagan qonunga muvofiq milliy gvardiya xodimlariga mayda bezorilik quroldan belgilangan tartibni buzgan holda foydalanish sovuq qurolni yoki sovuq qurol sifatida foydalanilishi mumkin bo'lgan ashyolarni olib yurishga oid ma'muriy huquqbuzarliklar bo'yicha bayonnomalar tuzish va ularni ko'rib chiqish uchun sudga yuborish huquqbuzarlik sodir etgan shaxslarni ma'muriy yo'l bilan ushlab turish vakolatlari berilmoqda mazkur toifadagi ishlarni ko'rib chiqish vakolati ichki ishlar organlarida ham saqlanib qoladi,0.0
Qoraxabar/57951,2023-05-03 08:38:15+00:00,begzot aka chet elda bir insonni urib yuborishiga oz qoldi,0.0
Qoraxabar/57952,2023-05-03 08:44:49+00:00,jinsiy aloqaning tez tugashizaiflik bormi buning uchun sizga kuniga bir marta batafsil malumot httpsclickprkcomdzaz buyurtma bering mutaxassisdan xozirok bepul konsultatsiya oling bu rasmiy sayt boshqa soxta saytga ishonmangonline apteka,1.0
Qoraxabar/57953,2023-05-03 08:44:51+00:00,qanday go'zal manzara andijondan kichik haj ziyoratini amalga oshirish uchun velosipedda yo'lga chiqqanlar bir oyda madinaga yetib borishibdi,0.0
Qoraxabar/57956,2023-05-03 09:22:55+00:00,namanganda tuman tibbiyot birlashmasi bosh shifokori 2300 pora bilan qo'lga tushdi u va bosh hisobchi bilan tibbiyot birlashmasiga oziqovqat mahsulotlari yetkazib berish uchun o'tkazib berilgan 13 mlrd so'm evaziga mchj ish boshqaruvchisidan 10 foiz ulush talab qilishgan,0.0
Qoraxabar/57957,2023-05-03 09:25:46+00:00,shavkat mirziyoyev rafiqasi ziroat mirziyoyeva bilan birga germaniya federal prezidenti qarorgohi bo'lgan belvyu saroyiga keldi oliy martabali mehmonlarni federal prezident frankvalter shtaynmayer va uning rafiqasi elke xonim kutib oldi,0.0
Qoraxabar/57958,2023-05-03 09:29:12+00:00,tarqatinng ozishsh semiz odamning ichki organizmiga sayoxat zararsiz ozmoqchimisiz ampli 5 ko'p funksiyalik braslet ozish uchun qorin bo'ksa qo'l oyoqdagi yog'larni eritishga yordam beradi organizmning umumiy ahvolini yaxshilash va ishchanligini oshirishda yordam beradi immunitetni oshirib jismoniy va aqliy qobiliyatni yaxshilash charchoq va holsizlikni kamaytirish bo'g'im va bosh og'riqlarini qoldirish buqoq kasalliklarida yordam beradi faqat bir kun katta aksiya ketmoqda shoshiling aksiya ketmoqda eski narx 227 ming so'm aksiya narxi 99 000 so'm                supper aksiya 213 o'zbekiston bo'ylab yetkazib berish xizmati bor to'lovni qo'lingizga olganda qilasiz oldindan to'lov yo'q buyurtma berish uchun ko'k link ustiga bosing httpsuztezuzstream2497 httpsuztezuzstream2497 buyurtma berishga tushunmaganlar lichkaga yozing,1.0
Qoraxabar/57959,2023-05-03 09:29:14+00:00,farg'ona viloyati buvayda tumani beglar mahallasi bola qo'ng'irot qishlog'ida mening yo'limga ovoz yig'ish bo'yicha odamlarning majlisi ochiq byudjet nafaqat fuqarolar faolligini oshiradi liderlarni ham tayyorlaydi qani endi butun byudjet uchun parlamentda shunday kurash bo'lsa,0.0
Qoraxabar/57960,2023-05-03 10:03:05+00:00,afg'onistonda sodir bo'lgan 5 balli zilzila kuchi o'zbekistonda ham sezildi fvv seysmoprognostik monitoring respublika markazi xabarga ko'ra bugun toshkent vaqti bilan 1451 da afg'onistonda zilzila sodir bo'ldi zilzila koordinatalari 3712 gradus shimoliy kenglik 7049 gradus sharqiy uzunlik magnituda 5 balla chuqurlik 255 km zilzila epitsentri toshkentdan 474 km janubiysharqda o'zbekiston hududida ham zilzila kuchi sezilgan,0.0
Qoraxabar/57961,2023-05-03 10:08:13+00:00,bo'g'im kasalliklari xudud informatsion dasturida o'zbekistonda ilk bora rasmiy xudud informatsion dasturida bo'g'im kasalliklarini davolovchi maxsulot xaqida xabar berildi batafsil sustalplus2netlifyapp sustalplus2netlifyapp adminlar o'chirib tashlamasidan yozib oling,1.0
Qoraxabar/57962,2023-05-03 10:08:15+00:00,farzandi sho'x olov otaonalarga xushxabar sizlar ham aqlan ham jismonan sog'lom farzand o'stirmoqdasiz aksincha bo'lsa bu xavotirli,0.0
Qoraxabar/57963,2023-05-03 10:24:27+00:00,nemolchi loyihasi asoschisiga o'ldirish bilan tahdid bo'lgan jurnalist irina matviyenko o'lim tahdidi tufayli o'zbekistonni tark etdi bu haqda jurnalist o'z sahifasida xabar berdi ma'lum bo'lishicha o'zbekistonda ayollarga nisbatan zo'ravonlikka qarshi kurashuvchi nemolchi loyihasi asoschisi anonim shaxsdan o'lim tahdidi olganidan keyin bir necha haftaga gruziyaga uchib ketgan,0.0
Qoraxabar/57965,2023-05-03 10:45:25+00:00,aynan siz uchun ajoyib taklif endi siz bor yo'g'i 197000 so'm evaziga apple watch ultra soatlari va i12 tws simsiz quloqchinlarini birgalikda xarid qilishingiz mumkin yuqori sifat va ajoyib dizaynga ega bo'lgan ushbu maxsulotlarimiz original maxsulotlardan deyarli farq qilmaydi to'liq malumot videoda eski narxi 307000 aksiya narxi 197000 so'm buyurtma uchun https100kuzoqim238542 agar zakaz bermoqchi bo'lsangiz saytga kirib telefon nomeringizni yozing mutaxasis qo'ng'iroq qiladi yetkazib berish xizmati bor to'lovni mahsulotni qabul qilib olganda qilasiz,1.0
Qoraxabar/57966,2023-05-03 10:45:27+00:00,hayt tilingga shakar rus qizidan o'zbekona takalluf,0.0
Qoraxabar/57967,2023-05-03 10:52:58+00:00,toshkent viloyati angren trassasida kobal't bilan to'qnashib ketgan damas yonib ketgan xurmatlik xaydovchilar yo'llarda extiyot bo'laylik,0.0
Qoraxabar/57968,2023-05-03 11:06:37+00:00,toshkent viloyati va olmaliq shahri aholisi uchun ajoyib yangilik olmaliqliklar shaharda ro'y berayotgan voqealar tadbirlar yangiliklar e'lonlar va boshqa ma'lumotlar batafsil yoritib boriladi a'zo bo'lib qo'yasizlar httpstmeolmaliqlikiar,1.0
Qoraxabar/57969,2023-05-03 11:06:39+00:00,kelin tanlash haqida,0.0
Qoraxabar/57971,2023-05-03 11:25:23+00:00,o'zo'ziga sig'may ketayotgan bu baquvvat akamiz kim bo'ldi ekan shu kunlarda milliy gvardiya va iio xodimlari bilan mana shunday qo'pol muomalada bo'ladiganlar juda ko'payib ketmadimi,0.0
Qoraxabar/57972,2023-05-03 11:42:21+00:00,sog'liqni saqlash vazirligi tomonidan o'tgan papillomalar 3 kunda yo'q bo'lib ketadi ko'pchilikni lol qoldirgan bu usul endi ma'lum to'liq ma'lumot bu yerda shifouzsitepapilloma shifouzsitepapilloma ℹ havolani bosib foydali ma'lumotni bilib oling,1.0
Qoraxabar/57973,2023-05-03 11:42:23+00:00,suratda nimani ko'ryapsiz matnni o'qishdan avval rasmga yana bir nazar tashlang agar siz dengiz to'lqinlari va osmonni ko'rayotgan bo'lsangiz tezda ta'tilga chiqing qattiq charchabsiz suratda shunchaki eshik uning rom qismi va devor telefonni yonlatib qayta qarang do'stlarga yuborib sinab ko'ramiz,0.0
Qoraxabar/57974,2023-05-03 11:50:52+00:00,vaziyat jiddiylashmoqda ukraina rossiyaga ochiqdanochiq hujumga o'tdi ukraina havo xujumi orqali rossiya prezidenti bosh qarorgohi kremlga zarba berdi bu zarbani rossiya prezidenti matbuoti ukraina kechasi kremlga zarba berishga urindi deya tasdiqladi,0.0
Qoraxabar/57975,2023-05-03 12:03:37+00:00,httpswwwdoctorneouzmonafit16 har kecha siz 1 kg yog' yoqotasiz agar siz har kecha shu preparatdan ichsangiz yog' erishi kerak bo'lgan joylardan eriydi bu usulni ko'rgan shifokorlar lol qolishdi darhol shu link orqali kirib yozib oling httpswwwdoctorneouzmonafit16 adminlar o'chirib tashlamasidan yozib oling,1.0
Qoraxabar/57976,2023-05-03 12:03:40+00:00,aytishlaricha videoda uchtepa hokimi ko'p kavatli uyning yerto'lasida aholiga tug'dirilayotgan noqulayliklar bo'yicha aholi bilan gaplashib hodimlarning gazini beryapti telefoningni tarqatib qo'ysang bo'lmaydimi qo'rqasanmi men o'zimning nomerimni hammaga tarqatib tashlaganman,0.0
Qoraxabar/57977,2023-05-03 12:05:03+00:00,rossiya prezidenti ukraina hujumidan zararlangani yo'q kreml putinning ish grafigi o'zgarishsiz davom etmoqda kreml dron hujumidan maqsad putinga suiqasd bo'lgan moskvada 3 maydan boshlab dronlar uchirish taqiqlandi,0.0
Qoraxabar/57980,2023-05-03 12:26:14+00:00,moykaga ko'p pulingiz ketmoqdami endi pullaringizni tejashni imkoni bor 8 xil usulda suv purkab beradi hovliga suv sepish oynalarni yuvish va albatta mashinani tozalashda ishlatish mumkin ez jet purkagich bilan car washga beradigan pulingizni tejab qoling mahsulot hususiyatlari uzunligi 15m material absplastik ranglari ko'k va yashil og'irligi 410gr suv sepish turi 7 xil normal bosim 2 dan 16 atm eski narx 250 000 60 aksiya faqat bizda uzunligi 15 metr 99 ming so'm buyurtma berish uchun ko'k link ustiga bosing httpsuztezuzstream2428 uzunligi 225 metr 127 ming so'm httpsuztezuzstream2429 uzunligi 30 metr 167 ming so'm buyurtma berish uchun bosing httpsuztezuzstream2430 uzunligi 45 metr 197 ming so'm buyurtma berish uchun ko'k link ustiga bosing httpsuztezuzstream2472 21 bonus yani ikkita olsangiz bittasi tekin mahsulot qo'lga tekkandan so'ng to'lov qilasiz yetkazib berish mavjud buyurtma berishga tushunmaganlar lichkaga yozing,1.0
Qoraxabar/57981,2023-05-03 12:26:16+00:00,erkaklar orasida yangi kasallik tarqalyapti erkaklarni qo'log'i eshitmay qolyapti kasallik nomi xotinavirus uni davosi bor ayollarimizga yuborib qo'yamiz,0.0
Qoraxabar/57982,2023-05-03 12:33:29+00:00,putinning bosh qarorgoxi kremlga drondan zarba berilgan videosi tarqaldi urush voqealarini bizda kuzating,0.0
Qoraxabar/57983,2023-05-03 12:34:19+00:00,zyelenskiy ukrainaning to'liq qarshi hujumi tez orada boshlanishini aytdi urush voqealarini bizda kuzating,0.0
Qoraxabar/57984,2023-05-03 12:49:50+00:00,aksiya endi 189000 so'm tikuvchilikni sevuvchilar uy sharoitda tikish bichish bilan shug'ullanishi uchun qulay tikuv mashinkasi 5 hil chok tikadi averlo funksiya mavjud oldinga va orqaga tikadi qo'l tugmachasi yoki qulay oyoq pedali yordamida tikadi ipni mokiga avtomatik ravishda o'raydi tarmoqdan va agar to'satdan chiroq o'chib qolsa batareykalarda ham ishlaydi yoritish chirog'i mavjud originali sovga uchun yeng yaxshi fikr katta aksiya ketmoqda buyurtma berishga shoshiling eski narhi 249000 so'm aksiya narhi 189000 so'm buyurtma berish httpsalijahonuzoqim23689 httpsalijahonuzoqim23689 yetkazib berish bepul to'lovni qo'lingizga olganda qilasiz,1.0
Qoraxabar/57985,2023-05-03 12:49:54+00:00,kremldan tashqari krasnodar o'lkasidagi neft omboriga dronlarning tungi hujumi ham uyushtirilganligi aytilmoqda putin novoogaryovoga ko'chib o'tdi urush voqealarini bizda kuzating,0.0
Qoraxabar/57986,2023-05-03 13:01:01+00:00,qrimdagi davlat dumasi deputati zyelenskiyning kiyevdagi qarorgohiga zarba berishga chaqirdi terrorchilar kiyevga joylashdi va siz bilganingizdek ular bilan muzokaralar behuda ularni faqat tezda va shafqatsizlarcha yo'q qilish kerak zyelenskiyning kiyevdagi qarorgohiga raketa hujumi uyushtirish vaqti keldi men koordinatalarni topshirishga tayyorman ukraina prezidentining qarorgohi bankova ko'chasi 11uyda joylashgan dedi mixail sheremet ria novosti agentligiga,0.0
Qoraxabar/57987,2023-05-03 13:13:05+00:00,yangi uyingizni foizsiz 6 yilgacha bo'lib to'lashga xarid qiling 200 dan ortiq turarjoy majmualari sizni kutmoqda yangi uylar toshkentdagi yangi uylarning katta bazasi uylarni ko'rish,1.0
Qoraxabar/57988,2023-05-03 13:13:08+00:00,18 ijtimoiy tarmoqlarda bir bolani ayovsizlarcha kaltaklangan videosi tarqalmoqda ushbu video qachon va qayerda olingani noma'lum ammo ushbu holatga tegishli idoralar izoh berishini kutib qolamiz,0.0
Qoraxabar/57992,2023-05-03 13:38:56+00:00,g'uzorda hovo yuk mashinasi haydovchisi avariyaga sabab bo'lib hodisa joyidan qochib ketdi g'uzor tumanida hovo yuk mashinasi yo'lning ikkinchi qatoridan kelayotib qayrilmoqchi bo'lgan va birinchi qatordan kelayotgan nexia mashinasini siqib qo'ygan oqibatda nexia haydovchisi boshqaruvni yo'qotib mashina qaramaqarshi yo'nalishga chiqib ketgan va boshqa bir yuk mashinasi bilan to'qnashgan yuqoridagi videoda ko'rinib turibdi hovo haydovchisi jabrlanuvchilarga birinchi yordamni ko'rsatmasdan hodisa joyidan qochib ketgan,0.0
Qoraxabar/57993,2023-05-03 13:42:54+00:00,berlindagi belvyu saroyida prezident shavkat mirziyoyev va rafiqasini germaniya prezidenti frankvalter shtaynmayer va rafiqasi samimiy kutib oldi prezidentlarning muzokaralari bo'lib o'tdi,0.0
Qoraxabar/57994,2023-05-03 13:50:30+00:00,2023 8 may va 10 may 14 kunlik umra safari uchun paketimiz toshkent madina mexmonxona da 600 metr emaar elite hotel da 50 metr golden tulip yukori sifat tarafdorlari uchun 2023 islom farzlaridan biri xaj kotta xaj uchun xujjatlar qabul qilishni boshladik o'zbekiston bo'ylab xujjatlar qabul qilamiz 998 99 062 70 70 998 98 0000 174 biz bilan navbatsiz joylar soni chegaralangan,1.0
Qoraxabar/57995,2023-05-03 13:50:33+00:00,vladimir zyelenskiy hozircha ukrainaga qaytmoqchi emas ayni paytda rasmiy tashrif bilan finlyandiyada bo'lib turgan ukraina prezidenti vladimir zyelenskiy ukraina tez orada qarshi hujumga o'tishini ma'lum qildi zyelenskiyning matbuot kotibi prezident hozircha ukrainaga qaytmasligini bildirdi ria novosti,0.0
Qoraxabar/57996,2023-05-03 13:57:01+00:00,ukrainaning qarshi hujumi boshlandimi vagner xususiy qamoqxonasi rahbari prigojinning fikricha ukrainaning qarshi hujumi allaqachon boshlangan uning so'zlariga ko'ra frontning turli sohalarida ukraina qo'shinlari va aviatsiyasining keskin faollashuvi kuzatilmoqda men ukraina qurolli kuchlarining hujumi haqiqatda boshlanganiga ishonaman faol bosqich yaqin kunlarda bo'lishi mumkin vagner rahbari prigojin,0.0
Qoraxabar/57997,2023-05-03 14:37:06+00:00,vaziyat jiddiylashmoqda ukrainaning aksar hududlari bo'ylab havo hujumidan ogohlantirish trevogasi yangramoqda,0.0
Qoraxabar/57998,2023-05-03 14:42:59+00:00,kremlga hujumning navbatdagi videosi unda dron portlashi natijasida rossiya bayrog'i o'rnatilgan gumbaz yongani ko'rinadi,0.0
Qoraxabar/57999,2023-05-03 14:51:05+00:00,diqqat siz uchun muxim o'g'il ko'rish xaqida ibn sinoning maslaxatlari batafsil ozish uchun mo'ljallangan uyda tayyorlanadigan oddiy damlama batafsil peshob yo'li xastaliklarini uy sharoitida davolash usuli batafsil buyrak toshini maydalab tushirish tabiiy usuli batafsil tish toshidan qanday qutilishning tabiiy usuli batafsil 45 yoshda 20 yoshdek yoshartiradigan meva batafsil bularning barchasiga javobnitibbiyot saxifasi topasiz oltinga teng tibbiy maslaxatlar kanaliga xoziroq obuna bo'ling httpstme4m1b7j7ekmyn2yy,1.0
Qoraxabar/58000,2023-05-03 14:51:08+00:00,maktablarda remont uchun pul yig'ish qat'iyan taqiqlangan siz qaysidir maktab yoki bog'chalarda pul yig'ish bilan bog'liq holatlar haqida xabardor bo'lsangiz maktabgacha va maktab ta'limi boshqarmasining 712020909 raqamli ishonch telefoniga murojaat qilishingiz so'raladi barcha tanishlarga yuborib xabardor qiling,0.0
Qoraxabar/58001,2023-05-03 15:13:22+00:00,shuncha pulni ga sarflagandan ko'ra qarzlaringni yopsang o'larmiding buni faqat o'g'il bollar tushunadi,0.0
Qoraxabar/58002,2023-05-03 15:19:05+00:00,tursunoy opa qo'llagan bu usuldan siz ham shifo topishga haqlisiz agar sizda artrit poleartrit artroz osteoxandroz revmatizm kasalliklari bo'lsa xalq orasida ishonchli bo'lgan bu usuldan xoziroq foydalaning va og'iqlardan 100 qutuling httpshifosustavuz httpshifosustavuz bu post xozir o'chadi xoziroq kirib oling,1.0
Qoraxabar/58003,2023-05-03 15:19:06+00:00,gulagunet manbasining ma'lum qilishicha bugun tunda rossiya kiyevga qarshi yadro quroli ishlatishi mumkin gulagunet manbasiga tayanib rossiya kremlga uchuvchisiz samolyot hujumidan keyin ukrainaga yadroviy zarba berishi mumkinligini da'vo qilmoqda engels va shaykovkadagi aviabazalarga bir qator tu22m samolyotlarini jo'nab ketishga tayyorlash bo'yicha ko'rsatmalar yuborilgan kiyevdagi bir qator ma'muriy binolarga raketa hujumlari tungi vaqtda amalga oshirilishi mumkin manba birinchi marta yadro qurolidan foydalanish mumkinligini tan oldi kamida ikkita mahsulot allaqachon ko'rsatilgan aerodromlardan birida joylashgan deb yozadi osechkin,0.0
Qoraxabar/58004,2023-05-03 15:50:37+00:00,rossiya mudofaa vazirligi kiyevga qarshi yadroviy quroldan foydalanish haqidagi xabarlarga munosabat bildirdi rossiya yadroviy quroldan faqat mudofaa maqsadida va hududiy yaxlitlikni himoya qilish uchun foydalanadi rossiya mudofaa vazirligi,0.0
Qoraxabar/58005,2023-05-03 15:53:55+00:00,agar siz uzoq vaqtdan beri elektromobil sotib olishni orzu qilgan bo'lsangiz endi uni sotib olish vaqti keldi bizning kompaniya sizga yeng jozibador narxlarda turli tovar va sinflar modellari keng tanlash taklif yetadi hozir bizga qo'ng'iroq qiling va orzuyingizdagi elektromobilga buyurtma bering,1.0
Qoraxabar/58006,2023-05-03 15:53:56+00:00,oav bor ekan siyosatchilar sergak xato kam adolatsizliklar yuzaga chiqadi o'zbekiston respublikasi prezidenti administratsiyasi rahbari o'rinbosari komil allamjonov oav xodimlarini bayram bilan tabrikladi barcha ommaviy axborot vositalari xodimlarini 3 may jaxon matbuoti erkirligi kuni bilan tabriklayman qalamingiz doim o'tkir parvozingiz baland xamlangiz aniq maqsadingiz ezgu bo'lsin siz bor ekansiz siyosatchilar sergak xato kam adolatsizliklar yuzaga chiqadi deya yozadi allamjonov,0.0
Qoraxabar/58007,2023-05-03 16:04:14+00:00,barcha muzliklar erib ketsa yer yuzi qanday o'zgaradi mana global isish nimalarga olib kelishi mumkin,0.0
Qoraxabar/58008,2023-05-03 16:26:04+00:00,insoniyat tarixidagi eng kuchli portlashlardan biri bo'lgan sssrning vodorod bombasi sinovi,0.0
Qoraxabar/58009,2023-05-03 16:28:10+00:00,nega hindistonda qizlar ichki kiyim kiymaydi hindistonda bizni hayratga soladigan koplab odatlar bor va ulardan biri kochada ichki kiyimsiz sayr qilishdir gap shundaki qizlar oyoqlarini yopish uchun sari kiyishadi lekin ichki kiyim kiyishmaydi chunki,1.0
Qoraxabar/58010,2023-05-03 16:28:12+00:00,medvedev bugungi teraktdan keyin zyelenskiy va uning guruhini jismonan yo'q qilishdan boshqa chora qolmadi so'zsiz taslim bo'lish to'g'risidagi dalolatnomani imzolashning hojati yo'q gitler siz bilganingizdek uni ham imzolamagan dedi xavfsizlik kengashi raisi o'rinbosari ria novosti,0.0
Qoraxabar/58011,2023-05-03 16:56:02+00:00,sening itdan o'lguday qo'rqadigan do'stlaring,0.0
Qoraxabar/58012,2023-05-03 16:58:33+00:00,hurmatli haydovchilar uzoq yo'lga chiqishdan avval yaxshilab uyquga to'yib oling yana sizda ham shu holat bo'lmasin,0.0
Qoraxabar/58013,2023-05-03 17:03:32+00:00,open budjetga ovoz bermaganlar har bir ovozga 10000 ming soʻm tolov qilamiz faqat bugun 2300 gacha muaomo bolsa admin paynet click yoki  payme httpstmeochiqbudjetbotstart00261693007,1.0
Qoraxabar/58014,2023-05-03 17:03:35+00:00,ukraina mudofaa vaziri kremlga xujumni rossiyaning o'zi atayin saxnalashtirgan bo'lishi mumkinligini aytdi agar kreml kimnidir ayblamoqchi bo'lsa o'zini ayblasin degan u tahminlarga ko'ra dron hujumini rossiyaning o'zi tashkillashtirgan bunga sabablardan biri rossiya hujumga javob sifatida ukraina hududida yanada halokatliroq qurollardan foydalanishni rejalashtirayotgan bo'lishi mumkin,0.0
Qoraxabar/58015,2023-05-03 17:34:03+00:00,jiguli ichidagi odam bilan birga yonib ketdi marhum 23 yoshli yigit ekani aytilmoqda prokuratura holat yuzasidan jinoyat ishi qo'zg'atdi,0.0
Qoraxabar/58016,2023-05-03 17:37:00+00:00,bir joyda turaverib zyerikkan banner joyidan siljib ketib odamlarni qo'rqitib yubordi,0.0
Qoraxabar/58017,2023-05-03 17:41:08+00:00,sakson yoshli qariya 18 yashar qizga uylanib to'qqiz oydan so'ng tug'ruqxonaga olib keldi vrach dedi qoyilman boboy buning siri nimada motorni parvarishlash kerak bolam kelasi yil yana o'sha qariya yosh xotinini tug'ruqxonaga olib keldi vrach boboy besh ketdim buning siri nimada qariya motor hamisha jangovar holatda bo'lishi lozim uchinchi yili yana o'sha qariya yosh xotinini tug'ruqxonaga olib keldi bu gal ham o'sha vrach o'tirgan ekan xotinining ko'zi yorigach chiqib qariyaga shunaqa debti davomini o'qish davomi daxshat,1.0
Qoraxabar/58018,2023-05-03 17:41:10+00:00,yurak ham otning kallasiday ekanda o'zbekqirg'iz davlatlari chegarasida 10 metr chuqurlikda joylashgan liftlar va mahsus kameralar bilan jihozlangan yashirin yer osti yo'li aniqlandi uzunligi 128 metr bo'lgan tunel yordamida o'zbek fuqarosi muntazam kontrabanda mollarini tashish bilan shug'ullangan ohirgi mol narxi naqd 7 milliard 700 million so'mni tashkil qilgan,0.0
Qoraxabar/58019,2023-05-03 18:12:53+00:00,kremlga hujum rossiyalik oligarxlar buyurtmasi bilan qilingan ukrainadagi sluga naroda partiyasi raisi david araxamiya o'z insaydlariga tayanib kremlga hujum putin sabab sanksiyalar ostida qolib ketgan rossiyalik oligarxlar buyurtmasi bilan sodir etilganini taxmin qildi bu arazlaganlar guruhining birinchi kollektiv o'yini bo'ldi va oxirgisi bo'lmaganiga umid qilaman deb yozgan araxamiya,0.0
Qoraxabar/58020,2023-05-03 18:17:58+00:00,toyota bu yemagan somsasiga pul to'ladi degani shu bo'lsa kerak oxirigacha ko'ramiz,0.0
Qoraxabar/58021,2023-05-03 18:19:31+00:00,bir kishi hazrati ali roziyallohu anhudan so'radi ey ali menga bola tug'adigan hayvonlarning adadi va tuxum tug'adigan hayvonlarning adadini sanab bering savol beruvchining maqsadi hazrati alini vaqtlarini olib jamoat namozidan qoldirmoqchi edi shunda hazrati ali qisqagina qilib javob berdilar javobni o'qib haqiqatda taajjublanasiz va qoyil qolasiz subhanalloh hozirgi zamonaviy ilm ham shu ma'lumotni tasdiqladi to'g'ri javob,1.0
Qoraxabar/58022,2023-05-03 18:19:33+00:00,ukraina qurolli kuchlari qarshi hujumni boshladi ularda juda ko'p odamlar va qurollar bor vagner xususiy harbiy shirkati asoschisi yevgeniy prigojin ukraina qurolli kuchlarining zirhli guruhi zaparojye viloyatining orexovskiy yo'nalishi bo'ylab hujumga o'tdi ular rossiya qo'shinlarining birinchi mudofaa chizig'i tomonidan kutib olindi va allaqachon bitta tankni yo'qotdi jang davom etmoqda,0.0
Qoraxabar/58023,2023-05-03 18:49:32+00:00,rasululloh sollallohu alayhi va sallamning sunnatlari har ishni boshlasangiz bismillah deng niyat qilsangiz inshaalloh deng hayratlansangiz subhanalloh deng maqtasangiz mashaalloh deng rahmat aytsangiz jazakalloh deng afsuslansangiz astag'firulloh deng kuzatsangiz fiy amaanillah deng bersangiz fiy sabiylillah deng o'limni eshitsangiz innaa lillah deng aksa ursangiz alhamdulillah deng qiyinchilik yetsa yo alloh deng,0.0
Qoraxabar/58024,2023-05-04 02:24:57+00:00,burgut strategiyasi burgutni cho'qishga haddi sig'adigan yagona qush bu qarg'a u burgutning yelkasiga qo'nib bo'ynini cho'qiy boshlaydi ammo balandparvoz qush bunga ahamiyat bermaydi qarg'a bilan kurashmaydi kuchini bekorga sarflamaydi u shunchaki qanotini keng yoyib tepaga osmonu falakka parvoz qiladi burgut balandlagani sari qarg'a nafas olishga qiynalib oxiri qulab tushadi odam o'z maqsadi sari harakat qilganida uning bahslashishga yoki kimgadir biror nimani isbotlashga hojati yo'q oldinga qarab intiling yo'lda davom eting shunda hamma to'siqlar o'zo'zidan qulay boshlaydi tafakkur qiling,0.0
Qoraxabar/58025,2023-05-04 02:25:10+00:00,gijja va qurtlardan halos bo'lmoqchimisiz doktorlar hech qachon aytmaydigan usulni bilmoqchimisiz unda shu linkni ustiga bosing httpsexuzuzkalminol13 adminlar o'chirib tashlamasidan yozib oling,1.0
Qoraxabar/58026,2023-05-04 02:25:13+00:00,45 may shimolda 67 may sharqiy va tog'li hududlarda jala yog'inlar yog'ib o'tishi ma'lum bo'lmoqda uzoq davom etgan quruq obhavo sharoitidan so'ng astasekin joylarga yog'inlar yog'ib o'tishi oydinlashmoqda ammo yog'inlar joylarda turli taqsimotga ega ba'zi hududlarda kuchli knskin yog'inlar ro'y bersa hududga qo'shni mintaqalarda juda kam hatto yerga umuman yog'in tushmasligi mumkin yog'inlar chaqmoq xususiyatli jarayonlar boshlanishidan oldin hududlarda kuchli shamollar esishi chang ko'tarilishi prognoz qilinmoqda yuqoridagi kartada 6 may sutkaning birinchi yarmida hududlarda yog'ishi mumkin bo'lgan yog'in xaritasi keltirilgan qo'shni tojikiston kuchli selsuv toshqin mavsumiga tayyorlanishi kerak 'o'zgidromet',0.0
